{
  "id": "agriculture-fixed-toothed-rack-and-opposed-grip-wire-strainer-01",
  "version": "1.0.0",
  "category": "modular",
  "assetKind": "prop",
  "theme": "agriculture",
  "style": "warm-handcrafted-village",
  "title": "Fixed Toothed Rack and Opposed Grip Wire Strainer",
  "description": "One complete newly authored static rack-type fence-wire-strainer-like tool exterior. A long bar has integral blunt rack teeth; an open U carriage surrounds it and carries a raised long hand lever, transverse pivot and short pawl-like tab. The fixed end and carriage each reach sideways to an opposed open C jaw housing with a complete blunt eccentric cam, leaving real lower mouth gaps. No wire is included. This is not a drum winch, webbing ratchet buckle or chain hoist renamed: the continuous rack, sliding-body exterior and two opposed grips create the whole organisation. All geometry newly authored. One static prop zero scenes, display-resting on finite housing and carriage backs. No working clamp, ratchet engagement, sliding, tension, load capacity, wire compatibility, fabrication, ergonomic or safety performance; mechanisms, interaction and animation unmade.",
  "bounds": {
    "x": 1.450000048,
    "y": 0.305999994,
    "z": 0.675999999,
    "unit": "m"
  },
  "triangles": 872,
  "materials": 4,
  "files": {
    "glb": {
      "path": "assets/agriculture/agriculture-fixed-toothed-rack-and-opposed-grip-wire-strainer-01/v1.0.0/model.glb",
      "size": 50424,
      "sha256": "009261903ebe05dab46d67fbe8e72837d22d2979c37ebcc7a6d65a8dcc0f413f"
    },
    "blend": {
      "path": "assets/agriculture/agriculture-fixed-toothed-rack-and-opposed-grip-wire-strainer-01/v1.0.0/source.blend",
      "size": 620556,
      "sha256": "087fb1138be6463bad448ac5bb15d915ce6a369b649de1271063860a50bf6179"
    },
    "generator": {
      "path": "assets/agriculture/agriculture-fixed-toothed-rack-and-opposed-grip-wire-strainer-01/v1.0.0/generate.py",
      "size": 30461,
      "sha256": "c49925a75fa8b24466146f7891f6f196a8e73a2c4f044299e53c82c6d028d067"
    },
    "render": {
      "path": "assets/agriculture/agriculture-fixed-toothed-rack-and-opposed-grip-wire-strainer-01/v1.0.0/thumbnail.png",
      "size": 465133,
      "sha256": "b9f499f9e3aeb5bc1fbf941ff60ba7d370ff53288c71edbec99d592cc5d64d0a"
    }
  },
  "status": "verified",
  "license": "All rights reserved"
}
