{
  "id": "industrial-fixed-open-trough-and-four-spring-vibratory-feeder-01",
  "version": "1.0.0",
  "category": "modular",
  "assetKind": "prop",
  "theme": "industrial",
  "style": "warm-handcrafted-village",
  "title": "Fixed Open Trough and Four Spring Vibratory Feeder",
  "description": "One newly authored whole empty fixed linear vibratory-feeder-style apparatus exterior. Four broad grounded soles and an open rectangular low frame support four complete exposed coarse coil-spring forms, each seated in full upper and lower discs. Two upper carriers hold a complete long open-front tray with a solid floor, outward-flared sides and one raised rear wall. Beneath the tray, two full separate transverse eccentric-motor-style housings have proud end covers and complete mounting saddles. No bowl, spiral track, mixing blade, belt, crop or bulk contents. This is not the previous circular spiral-bowl sorting feeder widened or a trough mixer emptied: the entire tray, spring, frame and paired underside-drive geometry is newly authored. One static model zero scenes, four opaque PBR roles. Springs are fixed closed art geometry, not elasticity or tuning. No vibration, motion, feed rate, bulk transport, powered mechanism, electrical, resonance, balance, isolation, bearing operation, load, engineering, manufacture or safety capability made or verified. Rigging, animation and interaction not made.",
  "bounds": {
    "x": 1.700000048,
    "y": 2.579999924,
    "z": 1.379999995,
    "unit": "m"
  },
  "triangles": 4208,
  "materials": 4,
  "files": {
    "glb": {
      "path": "assets/industrial/industrial-fixed-open-trough-and-four-spring-vibratory-feeder-01/v1.0.0/model.glb",
      "size": 219168,
      "sha256": "17d9875e5d802a3029d3cd9d99635474edcf4e1f5434a57dc04fd210eb2153ed"
    },
    "blend": {
      "path": "assets/industrial/industrial-fixed-open-trough-and-four-spring-vibratory-feeder-01/v1.0.0/source.blend",
      "size": 858020,
      "sha256": "efe9870c28f28bb261ce12c762e7567e81db110ac7c9ab11952792164c350693"
    },
    "generator": {
      "path": "assets/industrial/industrial-fixed-open-trough-and-four-spring-vibratory-feeder-01/v1.0.0/generate.py",
      "size": 31946,
      "sha256": "9f523fca9c1e3d0e76b00bafd0bdb5db7d5cb12d6ec92e9244cdbd9c25813930"
    },
    "render": {
      "path": "assets/industrial/industrial-fixed-open-trough-and-four-spring-vibratory-feeder-01/v1.0.0/thumbnail.png",
      "size": 548699,
      "sha256": "b036b0c415a3292ff2246cab2f17ce2ca957a0ea8c5392162cf8859e87e5f854"
    }
  },
  "status": "verified",
  "license": "All rights reserved"
}
