{
  "id": "education-whole-double-envelope-and-continuous-cristae-mitochondrion-01",
  "version": "1.0.0",
  "category": "props",
  "assetKind": "prop",
  "theme": "education",
  "style": "S01-clean-geometric",
  "title": "Whole Double Envelope and Continuous Cristae Mitochondrion",
  "description": "One wholly newly authored enlarged mitochondrial cutaway: a complete bean-like outer envelope surrounds a distinct inner boundary membrane which folds continuously inward into seven alternating broad cristae. All crista faces and their rounded returns belong to one connected inner-membrane mesh, with actual open cut-section channels communicating toward the intermembrane groove; they are not floating plates, separate stacks or repainted chloroplast grana. The upper roof is intentionally removed to show the architecture, and a low opaque basal section supports this teaching representation. One whole education model, zero scenes, four restrained opaque membrane and cut-surface material roles. Broad cut-open junctions, wall thickness, count and scale are schematic: no exact species or tissue, measured nanoscale anatomy, narrow native junction aperture, membrane bilayer, matrix-fluid volume, DNA, ribosome, ATP synthase, respiration, dynamics, molecular interaction or physical-stability claim. Nothing from old chloroplast domain geometry is reused. No textures, transparency, labels, rig, animation or biological simulation.",
  "bounds": {
    "x": 0.224,
    "y": 0.09,
    "z": 0.049,
    "unit": "m"
  },
  "triangles": 9216,
  "materials": 4,
  "files": {
    "glb": {
      "path": "assets/education/education-whole-double-envelope-and-continuous-cristae-mitochondrion-01/v1.0.0/model.glb",
      "size": 523396,
      "sha256": "5e305aceb327ba0e7143006fc88eeb8af1d150fae4b89f2f83c1b988f2a513e5"
    },
    "blend": {
      "path": "assets/education/education-whole-double-envelope-and-continuous-cristae-mitochondrion-01/v1.0.0/source.blend",
      "size": 1023660,
      "sha256": "d29dab9f290c26411658cd725def499d68e1d4640bf6da2f1a2a6461c5ebdf8d"
    },
    "generator": {
      "path": "assets/education/education-whole-double-envelope-and-continuous-cristae-mitochondrion-01/v1.0.0/generate.py",
      "size": 23003,
      "sha256": "bb54f772c0755446ed17e350692c2fd145acbb5ad5ff315f3a2e53a7a71f406f"
    },
    "render": {
      "path": "assets/education/education-whole-double-envelope-and-continuous-cristae-mitochondrion-01/v1.0.0/thumbnail.png",
      "size": 533192,
      "sha256": "797bfae890e794b77c26b1430e8b3eeb4fd1e25c99cb98910e5956af1a9942e2"
    }
  },
  "status": "verified",
  "license": "All rights reserved"
}
