{
  "id": "technology-fixed-raised-blade-and-open-fork-switch-display-01",
  "version": "1.0.0",
  "category": "props",
  "assetKind": "prop",
  "theme": "technology",
  "style": "S01-clean-geometric",
  "title": "Fixed Raised Blade and Open Fork Switch Display",
  "description": "One newly authored complete static single-blade knife-switch-style exhibit. A long chamfered ground board carries two distinct full insulating-style feet, two entire metal strap exteriors and two blank binding-post appearances. At the rear, a complete bridge and two genuinely bored annular ears support a full headed transverse pin and an independently bored blade-root collar. One long thick finite-blunt plate rises from this end hinge at a fixed angle and terminates inside a whole long dark grip. The separate front contact is one continuous thick U-shaped fork with a genuine deep empty slot and flared mouth, visibly clear of the raised plate. All numeric geometry is newly authored, not the earlier straight telegraph key rotated: there is no central balanced lever, finger button, spring, rear rest or under-lever point-contact pair. It is also not the twin-coil sounder with its electromagnets removed. Four opaque untextured constant PBR roles, closed editable bodies, metres, native Z up and actual horizontal bounds-centred ground datum. One prop, zero scenes; no wires or energised equipment. Fixed illustrative exterior only: no electrical circuit or wiring instructions, conductive continuity, voltage or current rating, insulation effectiveness, arc control, actual switching or disconnection, operating travel, mechanism fit, manufacture, handling, ergonomics or electrical safety guarantee. Rigging, animation and interaction are not made and are outside this static deliverable.",
  "bounds": {
    "x": 0.24,
    "y": 0.44,
    "z": 0.398593,
    "unit": "m"
  },
  "triangles": 1760,
  "materials": 4,
  "files": {
    "glb": {
      "path": "assets/technology/technology-fixed-raised-blade-and-open-fork-switch-display-01/v1.0.0/model.glb",
      "size": 90212,
      "sha256": "476f533f45ab0e91f20fb6f45ce8583547a9979681c7661c427f7e72d34f41d0"
    },
    "blend": {
      "path": "assets/technology/technology-fixed-raised-blade-and-open-fork-switch-display-01/v1.0.0/source.blend",
      "size": 687504,
      "sha256": "225736a7c11c8905b88070a69c2f5b7fbe2f8baa4fd374ad06178eedd51d427f"
    },
    "generator": {
      "path": "assets/technology/technology-fixed-raised-blade-and-open-fork-switch-display-01/v1.0.0/generate.py",
      "size": 27282,
      "sha256": "3f7ce72be48ad70141374d5f1acf97a5031937466259f78dc7d949c57cadeba1"
    },
    "render": {
      "path": "assets/technology/technology-fixed-raised-blade-and-open-fork-switch-display-01/v1.0.0/thumbnail.png",
      "size": 517265,
      "sha256": "c1a90451e3750b1280cdc324d79a4c31c9fc1bcc8f1aad58a7b70d1825eff88e"
    }
  },
  "status": "verified",
  "license": "All rights reserved"
}
