{
  "id": "culture-fixed-boat-trough-and-transverse-handwheel-yagen-01",
  "version": "1.0.0",
  "category": "props",
  "assetKind": "prop",
  "theme": "culture",
  "style": "S01-clean-geometric",
  "title": "Fixed Boat Trough and Transverse Handwheel Yagen",
  "description": "One newly authored complete yagen-inspired historical craft-vessel appearance, empty and fixed. A single continuous long boat-shaped body has a closed underside, full curved end walls, a thick open rim and a genuine deep V-like interior tapering to a narrow elongated floor. One entire lenticular vertical disc rests in the middle of this recess with its thin outer edge and thicker central cheeks. The complete disc has a real transverse centre bore occupied by one continuous wooden-look shaft with two integral turned hand grips. Two whole low bevelled cross shoes carry the vessel underside at finite contact patches. All boat rings, internal wall slopes, disc profile, complete transverse grip and support coordinates are independently authored. Unlike the earlier bowl mortar with a separate tapered pestle lying alongside, this complete organization places an axial handled disc inside a long shaped track. Unlike the standing treadle grindstone, there is no raised bearing frame, annular abrasive stone, pedal, crank link or forward tool rest; the disc directly seats in the vessel rather than being a borrowed suspended grinding wheel. No source mesh or numerical geometry from those old models is imported, extracted, reduced or recoloured. Five closed editable whole meshes, four opaque constant untextured PBR roles, metres native Z up and full horizontal-bounds-centred ground origin. One whole model zero scenes; components are not separately counted. Plain broad category inspiration only, not a measured historic replica, verified traditional material or manufacturing drawing. Small intentional fixed contact overlaps are used at the disc seat, shaft bore and support shoes. No medicinal substance, powder, pigment, ingredient, medicine preparation, treatment, chemical operation, usable grinding surface or performance is supplied. No disc travel, rotation, rolling fit, hand comfort, processing capability, friction, strength, load, equilibrium, manufacture or safety claim; no rigging, animation or interaction.",
  "bounds": {
    "x": 0.44999998807907104,
    "y": 0.3199999928474426,
    "z": 0.25699999928474426,
    "unit": "m"
  },
  "triangles": 2772,
  "materials": 4,
  "files": {
    "glb": {
      "path": "assets/culture/culture-fixed-boat-trough-and-transverse-handwheel-yagen-01/v1.0.0/model.glb",
      "size": 237312,
      "sha256": "80ba59883b40713070d2dfe79da8a3c3195e2e88530fc09369ca749d622f270a"
    },
    "blend": {
      "path": "assets/culture/culture-fixed-boat-trough-and-transverse-handwheel-yagen-01/v1.0.0/source.blend",
      "size": 889856,
      "sha256": "d0b434db17392f483f7901971fa3d10c9bab20c81fdea568e24941d997bf5cdb"
    },
    "generator": {
      "path": "assets/culture/culture-fixed-boat-trough-and-transverse-handwheel-yagen-01/v1.0.0/generate.py",
      "size": 13329,
      "sha256": "7f940f48155d7be7d3b47f3b6385f856f29317cd7aee6b1a510c3bf15be1d6f7"
    },
    "render": {
      "path": "assets/culture/culture-fixed-boat-trough-and-transverse-handwheel-yagen-01/v1.0.0/thumbnail.png",
      "size": 501507,
      "sha256": "f25521750f9a9c45f804064885fcf6609caa767e89bb1fae7689fbe3257a8094"
    }
  },
  "status": "verified",
  "license": "All rights reserved"
}
