{
  "id": "renewable-fixed-split-bucket-wheel-and-tangent-nozzle-display-01",
  "version": "1.0.0",
  "category": "props",
  "assetKind": "prop",
  "theme": "renewable",
  "style": "source-preserved-low-poly",
  "title": "Fixed Split Bucket Wheel And Tangent Nozzle Display",
  "description": "One newly authored complete static split-bucket impulse-wheel illustrative cutaway. A thick open-front round casing on two feet and a common bed surrounds one full shaft-mounted disk carrying ten integral-rooted double-concavity bucket shells. Each entire bucket is one closed thick numerical surface with two real recessed lobes separated by its continuous central raised ridge, not two disconnected bowls or painted cup markings. A complete hollow tapered tangential nozzle on its own tall bracket aims past the upper wheel edge without touching it. A real annular rear plate, long full shaft, rear bored bearing and pedestal, proud central cap and rear retainer complete the supported apparatus. The new tangential double-cup runner and separate nozzle differ from a twin-timber-rim flat-board waterwheel and from radial impeller blades within an expanding volute with axial intake. No old visible mesh is imported. One complete model zero scenes, four opaque constant untextured PBR roles, metres and Z up. A fixed simplified Pelton-inspired appearance only: no validated bucket lip, splitter or jet profile, inlet cutout design, water, sealed chamber, rotor clearance through motion, nozzle flow, power, generation, efficiency, hydraulic pressure, shaft transmission, bearing fit, manufacture, loading or equipment safety claim. No animation, rig or interaction.",
  "bounds": {
    "x": 1.3600000143051147,
    "y": 0.7099999785423279,
    "z": 1.1100000143051147,
    "unit": "m"
  },
  "triangles": 7548,
  "materials": 4,
  "files": {
    "glb": {
      "path": "assets/renewable/renewable-fixed-split-bucket-wheel-and-tangent-nozzle-display-01/v1.0.0/model.glb",
      "size": 651264,
      "sha256": "da9b92122a2b66b7a3d01668e2b0407f58439133bf49e1928aa8a545c1cbf875"
    },
    "blend": {
      "path": "assets/renewable/renewable-fixed-split-bucket-wheel-and-tangent-nozzle-display-01/v1.0.0/source.blend",
      "size": 1509440,
      "sha256": "a909ed8a217368842f1c7fb1931712bee6aca0d98c59b93cca19b4b82c16a706"
    },
    "generator": {
      "path": "assets/renewable/renewable-fixed-split-bucket-wheel-and-tangent-nozzle-display-01/v1.0.0/generate.py",
      "size": 17213,
      "sha256": "803d63149a11b6ac36a697aa5178f8e12c5070f5834e52928bbddc122a7cc6bb"
    },
    "render": {
      "path": "assets/renewable/renewable-fixed-split-bucket-wheel-and-tangent-nozzle-display-01/v1.0.0/thumbnail.png",
      "size": 551050,
      "sha256": "8f5b011732f4728c1c985e72597d39796c48982a43b4a89483c879cd970fecdf"
    }
  },
  "status": "verified",
  "license": "All rights reserved"
}
