{
  "id": "agriculture-fixed-open-tub-and-single-vertical-auger-feed-mixer-wagon-01",
  "version": "1.0.0",
  "category": "modular",
  "assetKind": "prop",
  "theme": "agriculture",
  "style": "warm-handcrafted-village",
  "title": "Fixed Open Tub and Single Vertical Auger Feed Mixer Wagon",
  "description": "One newly authored whole parked single-vertical-auger feed-mixer-wagon-style static display. A cross-tied two-wheel drawbar chassis and front parking foot carry a deep upright tapered open tub with real thick walls, a blind floor and continuous rim. A complete tapered central cone and one continuous thick rising helical flight are actually present inside the empty tub. A closed conformal side-door exterior and short empty U-section trough, full front ladder with return brackets, proud hubs, long V drawbar and genuinely open coupling eye complete the whole wagon. No tractor, livestock, feed, loose auger, accessories or separate scene platform. All visible coordinates newly authored; no old construction mixer, hopper, wheel, chassis or auger geometry imported. Not the portable tilted drum, transit drum truck, shallow radial-paddle pan station or dough hook mixer resized. One model zero scenes. Empty static art only: no mixing, cutting, flow through the closed side door, auger rotation, complete transmission, coupling fit, towing, ladder use, load, stability, engineering, manufacture or safety capability made or verified. Rigging, animation and interaction not made.",
  "bounds": {
    "x": 2.619999886,
    "y": 3.75,
    "z": 2.329999924,
    "unit": "m"
  },
  "triangles": 2796,
  "materials": 4,
  "files": {
    "glb": {
      "path": "assets/agriculture/agriculture-fixed-open-tub-and-single-vertical-auger-feed-mixer-wagon-01/v1.0.0/model.glb",
      "size": 156732,
      "sha256": "fa60526281bb2c72857502e66f733aa52f07a1eb6d928c431f335f25a0fc7203"
    },
    "blend": {
      "path": "assets/agriculture/agriculture-fixed-open-tub-and-single-vertical-auger-feed-mixer-wagon-01/v1.0.0/source.blend",
      "size": 800084,
      "sha256": "f79fdf380707b45daa1878c814b8b7b5e92f01746aed38cf0e08b6cbb7c9888e"
    },
    "generator": {
      "path": "assets/agriculture/agriculture-fixed-open-tub-and-single-vertical-auger-feed-mixer-wagon-01/v1.0.0/generate.py",
      "size": 34546,
      "sha256": "f94f69af49b8ddb175e8e44ce349a45d731934bcfcde2207636ff44adbd95de7"
    },
    "render": {
      "path": "assets/agriculture/agriculture-fixed-open-tub-and-single-vertical-auger-feed-mixer-wagon-01/v1.0.0/thumbnail.png",
      "size": 576894,
      "sha256": "38966f26c431f0913b9582fcf0604d8955644ab39ef5741365191323a3b37d5f"
    }
  },
  "status": "verified",
  "license": "All rights reserved"
}
